{
  "sampleMetadata": {
    "syntheticSample": true,
    "profileId": "RD24001-IMO-FAL-UNCEFACT-JSON-SAMPLE-1.0",
    "imoCompendiumVersion": "FAL.5/Circ.56",
    "datasetCode": "FAL1",
    "datasetName": "General Declaration",
    "datasetSlug": "fal1-general-declaration",
    "note": "Synthetic demonstration payload; not an official IMO normative JSON message."
  },
  "messageHeader": {
    "messageFunctionCode": {
      "content": "9",
      "listId": "1225",
      "listAgencyId": "UN/EDIFACT"
    },
    "authenticationDateTime": {
      "content": "2026-09-29T21:00:00Z"
    },
    "messageId": {
      "content": "FAL1-9300075-07",
      "schemeId": "RD24001-SAMPLE"
    },
    "arrivalDepartureCode": {
      "content": "A",
      "listId": "IMO-ArrivalDeparture"
    }
  },
  "ship": {
    "imoShipNumberId": {
      "content": "9300075",
      "schemeId": "IMOShipNumber",
      "schemeAgencyId": "IMO"
    },
    "shipName": "RD AMERICA BRIDGE",
    "callSignId": {
      "content": "DR0007"
    },
    "mmsiNumberId": {
      "content": "440000007",
      "schemeId": "MMSI"
    },
    "flagStateId": {
      "content": "MH",
      "schemeId": "ISO3166-1-alpha2"
    },
    "shipTypeCode": {
      "content": "70",
      "listId": "UNECE-Rec28"
    },
    "shipTypeName": "Container ship"
  },
  "voyage": {
    "voyageId": {
      "content": "RD26-007"
    },
    "portOfDepartureCode": {
      "content": "USOAK",
      "listId": "UNLOCODE"
    },
    "portOfDepartureName": "Oakland, United States",
    "portOfArrivalCode": {
      "content": "USLAX",
      "listId": "UNLOCODE"
    },
    "portOfArrivalName": "Los Angeles, United States",
    "estimatedArrivalDateTime": {
      "content": "2026-09-29T21:00:00Z"
    },
    "estimatedDepartureDateTime": {
      "content": "2026-09-30T11:00:00Z"
    },
    "nextPortCode": {
      "content": "JPTYO",
      "listId": "UNLOCODE"
    },
    "nextPortName": "Tokyo, Japan"
  },
  "imoDataReferences": {
    "messageHeader.messageFunctionCode": "IMO0305",
    "messageHeader.arrivalDepartureCode": "IMO0013",
    "messageHeader.authenticationDateTime": "IMO0014",
    "ship.imoShipNumberId": "IMO0140",
    "ship.shipName": "IMO0142",
    "ship.callSignId": "IMO0136",
    "ship.mmsiNumberId": "IMO0326",
    "ship.flagStateId": "IMO0138",
    "voyage.portOfArrivalCode": "IMO0108",
    "voyage.portOfArrivalName": "IMO0109",
    "voyage.estimatedArrivalDateTime": "IMO0064"
  },
  "generalDeclaration": {
    "master": {
      "familyName": "Master7",
      "givenName": "Alex",
      "roleCode": {
        "content": "MASTER"
      }
    },
    "agentAtPort": {
      "partyId": {
        "content": "AGT-KR-007"
      },
      "name": "RD Port Agency 7",
      "email": "agent7@example.invalid",
      "telephone": "+82-51-555-1006"
    },
    "crewCount": 19,
    "passengerCount": 0,
    "briefCargoDescription": "Containerized general cargo",
    "grossTonnageMeasure": {
      "content": 50100,
      "unitCode": "GT"
    },
    "netTonnageMeasure": {
      "content": 26800,
      "unitCode": "NT"
    }
  }
}